{
  "schema_version": "0.1",
  "plan_id": "plan-919299f9614d",
  "asset_sha256": "fe504e9b7676ae389d1a2c4fc3d233ead84ca66422f3f7ff792969808040648b",
  "profile": {
    "id": "web-realtime",
    "version": "0.2"
  },
  "state": "READY",
  "steps": [
    {
      "step_id": "step-001",
      "finding_ids": [
        "f-0001"
      ],
      "skill": "mesh-safe-repair",
      "operation": "remove_degenerate_triangles",
      "parameters": {
        "primitive_mode": "TRIANGLES",
        "preserve_buffer_layout": true
      },
      "expected_changes": [
        "degenerate_triangle_count -> 0",
        "index accessor count decreases or stays equal"
      ],
      "verify_rules": [
        "mesh.degenerate_triangles",
        "package.bounds",
        "package.references",
        "profile.budgets"
      ],
      "risk_level": "L1",
      "rollback_on": [
        "tool_error",
        "target_unresolved",
        "new_error_finding",
        "checks_incomplete"
      ]
    }
  ],
  "risk_level": "L1",
  "approval_required": false,
  "reason": "all ERROR findings map to the tested L1 repair whitelist",
  "created_at": "2026-08-06T08:29:29.230427+00:00"
}
