{
  "schema_version": "0.1",
  "plan_id": "plan-d94fa5c4f505",
  "asset_sha256": "46f324f7c888b2f9ad5ec5aa1144e10814d183b9abecf6d2d342c0bc4153cb59",
  "profile": {
    "id": "web-realtime",
    "version": "0.2"
  },
  "state": "NO_ACTION",
  "steps": [],
  "risk_level": "L0",
  "approval_required": false,
  "reason": "asset audit contains no ERROR findings",
  "created_at": "2026-08-06T08:29:29.121252+00:00"
}
